<?xml version="1.0" encoding="UTF-8"?>
<xsd:schema xmlns:xsd="http://www.w3.org/2001/XMLSchema" xmlns:od="urn:schemas-microsoft-com:officedata">
<xsd:element name="dataroot">
<xsd:complexType>
<xsd:sequence>
<xsd:element ref="_x0033_0_Codebooks" minOccurs="0" maxOccurs="unbounded"/>
</xsd:sequence>
<xsd:attribute name="generated" type="xsd:dateTime"/>
</xsd:complexType>
</xsd:element>
<xsd:element name="_x0033_0_Codebooks">
<xsd:annotation>
<xsd:appinfo>
<od:index index-name="CodebookExperience" index-key="CodebookExperience " primary="no" unique="no" clustered="no" order="asc"/>
<od:index index-name="CodebookID" index-key="CodebookID " primary="yes" unique="yes" clustered="no" order="asc"/>
<od:index index-name="CodebookLanguage1" index-key="CodebookLanguage " primary="no" unique="no" clustered="no" order="asc"/>
<od:index index-name="CodebookName" index-key="CodebookName " primary="no" unique="no" clustered="no" order="asc"/>
<od:tableProperty name="GUID" type="9" value="u1pQh3LMGkGsSaKYDCRGdw==
"/>
<od:tableProperty name="Orientation" type="2" value="0"/>
<od:tableProperty name="OrderByOn" type="1" value="0"/>
<od:tableProperty name="NameMap" type="11" value="CswOVQAAAAC7WlCHcswaQaxJopgMJEZ3AAAAAMSNvcOVYOZAAAAAAAAAAAAzADAA
XwBDAG8AZABlAGIAbwBvAGsAcwAAAAAAAAA1b8hzrJckTKfsGd9+lLFMAAAAANTK
0ttxZeZAAAAAAAAAAAAzADIAXwBDAG8AZABlAGIAbwBvAGsATwBwAHQAaQBvAG4A
TQBhAHAAAAAAAAAA7lnjE189Gk2ddD6FP4+/JQcAAAC7WlCHcswaQaxJopgMJEZ3
QwBvAGQAZQBiAG8AbwBrAEkARAAAAAAAAACEt8ZiilXIRLB0VNP/ePepBwAAALta
UIdyzBpBrEmimAwkRndDAG8AZABlAGIAbwBvAGsATgBhAG0AZQAAAAAAAABdFuIy
3j3MTZHtUiLtQ5L2AAAAAM4VG9cYK+ZAAAAAAAAAAAAzADMAXwBFAHgAcABlAHIA
aQBlAG4AYwBlAHMAAAAAAAAAo9XVHUvdAkSHSXsrNiQEQQcAAABdFuIy3j3MTZHt
UiLtQ5L2RQB4AHAAZQByAGkAZQBuAGMAZQBJAEQAAAAAAAAA2NJuSWbSEkiHtdze
I/PvgwcAAABdFuIy3j3MTZHtUiLtQ5L2RQB4AHAAZQByAGkAZQBuAGMAZQAAAAAA
AAD6fMl0lA4UTYJdp6hDq/yiBwAAALtaUIdyzBpBrEmimAwkRndDAG8AZABlAGIA
bwBvAGsARQB4AHAAZQByAGkAZQBuAGMAZQAAAAAAAABqYTCfkURZSY48cDc8kVA3
AAAAAKdDCscTZOZAAAAAAAAAAAA5ADAAXwBMAGEAbgBnAHUAYQBnAGUAcwAAAAAA
AACrMY2PjWV6Tp3M5t6QklJQBwAAAGphMJ+RRFlJjjxwNzyRUDdMAGEAbgBnAGEA
dQBnAGUASQBEAAAAAAAAAHO1cvlc2OxAvFlWCyVKOUUHAAAAamEwn5FEWUmOPHA3
PJFQN0wAYQBuAGcAdQBhAGcAZQAAAAAAAACeE/eDKm20SoZ/QPSDcWGsBwAAALta
UIdyzBpBrEmimAwkRndDAG8AZABlAGIAbwBvAGsATABhAG4AZwB1AGEAZwBlAAAA
AAAAAAAAAAAAAAAAAAAAAAAAAAAMAAAABQAAAAAAAAAAAAAAAAAAAAAA
"/>
<od:tableProperty name="DefaultView" type="2" value="2"/>
<od:tableProperty name="DisplayViewsOnSharePointSite" type="2" value="1"/>
<od:tableProperty name="TotalsRow" type="1" value="0"/>
<od:tableProperty name="FilterOnLoad" type="1" value="0"/>
<od:tableProperty name="OrderByOnLoad" type="1" value="1"/>
<od:tableProperty name="HideNewField" type="1" value="0"/>
<od:tableProperty name="BackTint" type="6" value="100"/>
<od:tableProperty name="BackShade" type="6" value="100"/>
<od:tableProperty name="ThemeFontIndex" type="4" value="-1"/>
<od:tableProperty name="AlternateBackThemeColorIndex" type="4" value="-1"/>
<od:tableProperty name="AlternateBackTint" type="6" value="100"/>
<od:tableProperty name="AlternateBackShade" type="6" value="100"/>
<od:tableProperty name="ReadOnlyWhenDisconnected" type="1" value="0"/>
<od:tableProperty name="DatasheetGridlinesThemeColorIndex" type="4" value="-1"/>
<od:tableProperty name="DatasheetForeThemeColorIndex" type="4" value="-1"/>
<od:tableProperty name="PublishToWeb" type="2" value="1"/>
<od:tableProperty name="Filter" type="12" value="([Lookup_CodebookLanguage].[Language]=&quot;Urdu&quot;)"/>
</xsd:appinfo>
</xsd:annotation>
<xsd:complexType>
<xsd:sequence>
<xsd:element name="CodebookID" minOccurs="1" od:jetType="double" od:sqlSType="float" od:nonNullable="yes" type="xsd:double">
<xsd:annotation>
<xsd:appinfo>
<od:fieldProperty name="Format" type="10" value="General Number"/>
<od:fieldProperty name="GUID" type="9" value="7lnjE189Gk2ddD6FP4+/JQ==
"/>
<od:fieldProperty name="ColumnWidth" type="3" value="-1"/>
<od:fieldProperty name="ColumnOrder" type="3" value="1"/>
<od:fieldProperty name="ColumnHidden" type="1" value="0"/>
<od:fieldProperty name="DecimalPlaces" type="2" value="255"/>
<od:fieldProperty name="Required" type="1" value="1"/>
<od:fieldProperty name="DisplayControl" type="3" value="109"/>
<od:fieldProperty name="TextAlign" type="2" value="0"/>
<od:fieldProperty name="AggregateType" type="4" value="-1"/>
<od:fieldProperty name="ResultType" type="2" value="0"/>
<od:fieldProperty name="CurrencyLCID" type="4" value="0"/>
<od:fieldProperty name="Description" type="10" value="A codebook is a colllection of response options having a language and an experience attribute."/>
</xsd:appinfo>
</xsd:annotation>
</xsd:element>
<xsd:element name="CodebookName" minOccurs="0" od:jetType="text" od:sqlSType="nvarchar">
<xsd:annotation>
<xsd:appinfo>
<od:fieldProperty name="Format" type="10" value="@"/>
<od:fieldProperty name="GUID" type="9" value="hLfGYopVyESwdFTT/3j3qQ==
"/>
<od:fieldProperty name="ColumnWidth" type="3" value="3060"/>
<od:fieldProperty name="ColumnOrder" type="3" value="0"/>
<od:fieldProperty name="ColumnHidden" type="1" value="0"/>
<od:fieldProperty name="Required" type="1" value="0"/>
<od:fieldProperty name="AllowZeroLength" type="1" value="1"/>
<od:fieldProperty name="DisplayControl" type="3" value="109"/>
<od:fieldProperty name="IMEMode" type="2" value="0"/>
<od:fieldProperty name="IMESentenceMode" type="2" value="3"/>
<od:fieldProperty name="UnicodeCompression" type="1" value="0"/>
<od:fieldProperty name="TextAlign" type="2" value="0"/>
<od:fieldProperty name="AggregateType" type="4" value="-1"/>
<od:fieldProperty name="ResultType" type="2" value="0"/>
<od:fieldProperty name="CurrencyLCID" type="4" value="0"/>
</xsd:appinfo>
</xsd:annotation>
<xsd:simpleType>
<xsd:restriction base="xsd:string">
<xsd:maxLength value="255"/>
</xsd:restriction>
</xsd:simpleType>
</xsd:element>
<xsd:element name="CodebookExperience" minOccurs="0" od:jetType="longinteger" od:sqlSType="int" type="xsd:int">
<xsd:annotation>
<xsd:appinfo>
<od:fieldProperty name="GUID" type="9" value="+nzJdJQOFE2CXaeoQ6v8og==
"/>
<od:fieldProperty name="ColumnWidth" type="3" value="2400"/>
<od:fieldProperty name="ColumnOrder" type="3" value="0"/>
<od:fieldProperty name="ColumnHidden" type="1" value="0"/>
<od:fieldProperty name="DecimalPlaces" type="2" value="255"/>
<od:fieldProperty name="Required" type="1" value="0"/>
<od:fieldProperty name="DisplayControl" type="3" value="111"/>
<od:fieldProperty name="RowSourceType" type="10" value="Table/Query"/>
<od:fieldProperty name="RowSource" type="12" value="SELECT [33_Experiences].ExperienceID, [33_Experiences].Experience FROM 33_Experiences ORDER BY [ExperienceID]; "/>
<od:fieldProperty name="BoundColumn" type="3" value="1"/>
<od:fieldProperty name="ColumnCount" type="3" value="2"/>
<od:fieldProperty name="ColumnHeads" type="1" value="0"/>
<od:fieldProperty name="ColumnWidths" type="10" value="0;1440"/>
<od:fieldProperty name="ListRows" type="3" value="16"/>
<od:fieldProperty name="ListWidth" type="10" value="1440twip"/>
<od:fieldProperty name="LimitToList" type="1" value="1"/>
<od:fieldProperty name="AllowMultipleValues" type="1" value="0"/>
<od:fieldProperty name="TextAlign" type="2" value="0"/>
<od:fieldProperty name="AllowValueListEdits" type="1" value="0"/>
<od:fieldProperty name="AggregateType" type="4" value="-1"/>
<od:fieldProperty name="ShowOnlyRowSourceValues" type="1" value="0"/>
<od:fieldProperty name="ResultType" type="2" value="0"/>
<od:fieldProperty name="CurrencyLCID" type="4" value="0"/>
</xsd:appinfo>
</xsd:annotation>
</xsd:element>
<xsd:element name="CodebookLanguage" minOccurs="0" od:jetType="longinteger" od:sqlSType="int" type="xsd:int">
<xsd:annotation>
<xsd:appinfo>
<od:fieldProperty name="GUID" type="9" value="nhP3gypttEqGf0D0g3FhrA==
"/>
<od:fieldProperty name="ColumnWidth" type="3" value="2340"/>
<od:fieldProperty name="ColumnOrder" type="3" value="0"/>
<od:fieldProperty name="ColumnHidden" type="1" value="0"/>
<od:fieldProperty name="DecimalPlaces" type="2" value="255"/>
<od:fieldProperty name="Required" type="1" value="0"/>
<od:fieldProperty name="DisplayControl" type="3" value="111"/>
<od:fieldProperty name="RowSourceType" type="10" value="Table/Query"/>
<od:fieldProperty name="RowSource" type="12" value="SELECT [90_Languages].LangaugeID, [90_Languages].Language FROM 90_Languages ORDER BY [Language]; "/>
<od:fieldProperty name="BoundColumn" type="3" value="1"/>
<od:fieldProperty name="ColumnCount" type="3" value="2"/>
<od:fieldProperty name="ColumnHeads" type="1" value="0"/>
<od:fieldProperty name="ColumnWidths" type="10" value="0;1440"/>
<od:fieldProperty name="ListRows" type="3" value="16"/>
<od:fieldProperty name="ListWidth" type="10" value="1440twip"/>
<od:fieldProperty name="LimitToList" type="1" value="1"/>
<od:fieldProperty name="AllowMultipleValues" type="1" value="0"/>
<od:fieldProperty name="TextAlign" type="2" value="0"/>
<od:fieldProperty name="AllowValueListEdits" type="1" value="1"/>
<od:fieldProperty name="AggregateType" type="4" value="-1"/>
<od:fieldProperty name="ShowOnlyRowSourceValues" type="1" value="0"/>
<od:fieldProperty name="ResultType" type="2" value="0"/>
<od:fieldProperty name="CurrencyLCID" type="4" value="0"/>
</xsd:appinfo>
</xsd:annotation>
</xsd:element>
</xsd:sequence>
</xsd:complexType>
</xsd:element>
</xsd:schema>
