<?xml version="1.0" encoding="UTF-8"?>
<dataroot xmlns:od="urn:schemas-microsoft-com:officedata" xmlns:xsi="http://www.w3.org/2001/XMLSchema-instance"  xsi:noNamespaceSchemaLocation="30_Codebooks.xsd" generated="2026-02-03T10:51:23">
<_x0033_0_Codebooks>
<CodebookID>1</CodebookID>
<CodebookName>4.0-item-Frequency-English</CodebookName>
<CodebookExperience>1</CodebookExperience>
<CodebookLanguage>1</CodebookLanguage>
</_x0033_0_Codebooks>
<_x0033_0_Codebooks>
<CodebookID>2</CodebookID>
<CodebookName>4.0-item-Frequency-Arabic</CodebookName>
<CodebookExperience>1</CodebookExperience>
<CodebookLanguage>2</CodebookLanguage>
</_x0033_0_Codebooks>
<_x0033_0_Codebooks>
<CodebookID>3</CodebookID>
<CodebookName>4.0-item-Frequency-Chinese (Simplified)</CodebookName>
<CodebookExperience>1</CodebookExperience>
<CodebookLanguage>3</CodebookLanguage>
</_x0033_0_Codebooks>
<_x0033_0_Codebooks>
<CodebookID>4</CodebookID>
<CodebookName>4.0-item-Frequency-Danish</CodebookName>
<CodebookExperience>1</CodebookExperience>
<CodebookLanguage>4</CodebookLanguage>
</_x0033_0_Codebooks>
<_x0033_0_Codebooks>
<CodebookID>5</CodebookID>
<CodebookName>4.0-item-Frequency-Dutch</CodebookName>
<CodebookExperience>1</CodebookExperience>
<CodebookLanguage>5</CodebookLanguage>
</_x0033_0_Codebooks>
<_x0033_0_Codebooks>
<CodebookID>6</CodebookID>
<CodebookName>4.0-item-Frequency-Estonian</CodebookName>
<CodebookExperience>1</CodebookExperience>
<CodebookLanguage>6</CodebookLanguage>
</_x0033_0_Codebooks>
<_x0033_0_Codebooks>
<CodebookID>7</CodebookID>
<CodebookName>4.0-item-Frequency-Finnish</CodebookName>
<CodebookExperience>1</CodebookExperience>
<CodebookLanguage>7</CodebookLanguage>
</_x0033_0_Codebooks>
<_x0033_0_Codebooks>
<CodebookID>8</CodebookID>
<CodebookName>4.0-item-Frequency-French</CodebookName>
<CodebookExperience>1</CodebookExperience>
<CodebookLanguage>8</CodebookLanguage>
</_x0033_0_Codebooks>
<_x0033_0_Codebooks>
<CodebookID>9</CodebookID>
<CodebookName>4.0-item-Frequency-German</CodebookName>
<CodebookExperience>1</CodebookExperience>
<CodebookLanguage>9</CodebookLanguage>
</_x0033_0_Codebooks>
<_x0033_0_Codebooks>
<CodebookID>10</CodebookID>
<CodebookName>4.0-item-Frequency-Greek</CodebookName>
<CodebookExperience>1</CodebookExperience>
<CodebookLanguage>10</CodebookLanguage>
</_x0033_0_Codebooks>
<_x0033_0_Codebooks>
<CodebookID>11</CodebookID>
<CodebookName>4.0-item-Frequency-Hungarian</CodebookName>
<CodebookExperience>1</CodebookExperience>
<CodebookLanguage>11</CodebookLanguage>
</_x0033_0_Codebooks>
<_x0033_0_Codebooks>
<CodebookID>12</CodebookID>
<CodebookName>4.0-item-Frequency-Icelandic</CodebookName>
<CodebookExperience>1</CodebookExperience>
<CodebookLanguage>12</CodebookLanguage>
</_x0033_0_Codebooks>
<_x0033_0_Codebooks>
<CodebookID>13</CodebookID>
<CodebookName>4.0-item-Frequency-Japanese</CodebookName>
<CodebookExperience>1</CodebookExperience>
<CodebookLanguage>13</CodebookLanguage>
</_x0033_0_Codebooks>
<_x0033_0_Codebooks>
<CodebookID>14</CodebookID>
<CodebookName>4.0-item-Frequency-Korean</CodebookName>
<CodebookExperience>1</CodebookExperience>
<CodebookLanguage>14</CodebookLanguage>
</_x0033_0_Codebooks>
<_x0033_0_Codebooks>
<CodebookID>15</CodebookID>
<CodebookName>4.0-item-Frequency-Lithuanian</CodebookName>
<CodebookExperience>1</CodebookExperience>
<CodebookLanguage>15</CodebookLanguage>
</_x0033_0_Codebooks>
<_x0033_0_Codebooks>
<CodebookID>16</CodebookID>
<CodebookName>4.0-item-Frequency-Norweigan</CodebookName>
<CodebookExperience>1</CodebookExperience>
<CodebookLanguage>16</CodebookLanguage>
</_x0033_0_Codebooks>
<_x0033_0_Codebooks>
<CodebookID>17</CodebookID>
<CodebookName>4.0-item-Frequency-Persian</CodebookName>
<CodebookExperience>1</CodebookExperience>
<CodebookLanguage>17</CodebookLanguage>
</_x0033_0_Codebooks>
<_x0033_0_Codebooks>
<CodebookID>18</CodebookID>
<CodebookName>4.0-item-Frequency-Polish</CodebookName>
<CodebookExperience>1</CodebookExperience>
<CodebookLanguage>18</CodebookLanguage>
</_x0033_0_Codebooks>
<_x0033_0_Codebooks>
<CodebookID>19</CodebookID>
<CodebookName>4.0-item-Frequency-Portuguese</CodebookName>
<CodebookExperience>1</CodebookExperience>
<CodebookLanguage>19</CodebookLanguage>
</_x0033_0_Codebooks>
<_x0033_0_Codebooks>
<CodebookID>20</CodebookID>
<CodebookName>4.0-item-Frequency-Slovene</CodebookName>
<CodebookExperience>1</CodebookExperience>
<CodebookLanguage>20</CodebookLanguage>
</_x0033_0_Codebooks>
<_x0033_0_Codebooks>
<CodebookID>21</CodebookID>
<CodebookName>4.0-item-Frequency-Spanish</CodebookName>
<CodebookExperience>1</CodebookExperience>
<CodebookLanguage>21</CodebookLanguage>
</_x0033_0_Codebooks>
<_x0033_0_Codebooks>
<CodebookID>22</CodebookID>
<CodebookName>4.0-item-Frequency-Swedish</CodebookName>
<CodebookExperience>1</CodebookExperience>
<CodebookLanguage>22</CodebookLanguage>
</_x0033_0_Codebooks>
<_x0033_0_Codebooks>
<CodebookID>23</CodebookID>
<CodebookName>4.0-item-Frequency-Turkish</CodebookName>
<CodebookExperience>1</CodebookExperience>
<CodebookLanguage>23</CodebookLanguage>
</_x0033_0_Codebooks>
<_x0033_0_Codebooks>
<CodebookID>24</CodebookID>
<CodebookName>4.0-item-Frequency-Urdu</CodebookName>
<CodebookExperience>1</CodebookExperience>
<CodebookLanguage>24</CodebookLanguage>
</_x0033_0_Codebooks>
<_x0033_0_Codebooks>
<CodebookID>25</CodebookID>
<CodebookName>4.0-item-Agreement-English</CodebookName>
<CodebookExperience>5</CodebookExperience>
<CodebookLanguage>1</CodebookLanguage>
</_x0033_0_Codebooks>
<_x0033_0_Codebooks>
<CodebookID>26</CodebookID>
<CodebookName>4.0-item-Agreement-Spanish</CodebookName>
<CodebookExperience>5</CodebookExperience>
<CodebookLanguage>21</CodebookLanguage>
</_x0033_0_Codebooks>
<_x0033_0_Codebooks>
<CodebookID>27</CodebookID>
<CodebookName>4.1-item-Frequency-English</CodebookName>
<CodebookExperience>1</CodebookExperience>
<CodebookLanguage>1</CodebookLanguage>
</_x0033_0_Codebooks>
<_x0033_0_Codebooks>
<CodebookID>28</CodebookID>
<CodebookName>4.2-item-Frequency-English</CodebookName>
<CodebookExperience>1</CodebookExperience>
<CodebookLanguage>1</CodebookLanguage>
</_x0033_0_Codebooks>
<_x0033_0_Codebooks>
<CodebookID>29</CodebookID>
<CodebookName>4.0-item-Frequency-Swahili</CodebookName>
<CodebookExperience>1</CodebookExperience>
<CodebookLanguage>26</CodebookLanguage>
</_x0033_0_Codebooks>
<_x0033_0_Codebooks>
<CodebookID>30</CodebookID>
<CodebookName>4.0-item-Agreement-Norwegian</CodebookName>
<CodebookExperience>5</CodebookExperience>
<CodebookLanguage>16</CodebookLanguage>
</_x0033_0_Codebooks>
<_x0033_0_Codebooks>
<CodebookID>31</CodebookID>
<CodebookName>4.0-item-Frequency-Hindi</CodebookName>
<CodebookExperience>1</CodebookExperience>
<CodebookLanguage>31</CodebookLanguage>
</_x0033_0_Codebooks>
<_x0033_0_Codebooks>
<CodebookID>32</CodebookID>
<CodebookName>4.1-item-Frequency-Hindi</CodebookName>
<CodebookExperience>1</CodebookExperience>
<CodebookLanguage>31</CodebookLanguage>
</_x0033_0_Codebooks>
<_x0033_0_Codebooks>
<CodebookID>33</CodebookID>
<CodebookName>4.0-item-Frequency-Punjabi</CodebookName>
<CodebookExperience>1</CodebookExperience>
<CodebookLanguage>32</CodebookLanguage>
</_x0033_0_Codebooks>
<_x0033_0_Codebooks>
<CodebookID>34</CodebookID>
<CodebookName>4.0-item-Frequency-Mongolian</CodebookName>
<CodebookExperience>1</CodebookExperience>
<CodebookLanguage>38</CodebookLanguage>
</_x0033_0_Codebooks>
<_x0033_0_Codebooks>
<CodebookID>35</CodebookID>
<CodebookName>4.2-item-Frequency-Arabic</CodebookName>
<CodebookExperience>1</CodebookExperience>
<CodebookLanguage>2</CodebookLanguage>
</_x0033_0_Codebooks>
<_x0033_0_Codebooks>
<CodebookID>36</CodebookID>
<CodebookName>4.0-item-Frequency-Marathi</CodebookName>
<CodebookExperience>1</CodebookExperience>
<CodebookLanguage>40</CodebookLanguage>
</_x0033_0_Codebooks>
<_x0033_0_Codebooks>
<CodebookID>37</CodebookID>
<CodebookName>4.0-item-Frequency-Serbian</CodebookName>
<CodebookExperience>1</CodebookExperience>
<CodebookLanguage>27</CodebookLanguage>
</_x0033_0_Codebooks>
<_x0033_0_Codebooks>
<CodebookID>38</CodebookID>
<CodebookName>4.0-item-Frequency-Vietnamese</CodebookName>
<CodebookExperience>1</CodebookExperience>
<CodebookLanguage>39</CodebookLanguage>
</_x0033_0_Codebooks>
<_x0033_0_Codebooks>
<CodebookID>39</CodebookID>
<CodebookName>4.0-item-Frequency-Italian</CodebookName>
<CodebookExperience>1</CodebookExperience>
<CodebookLanguage>36</CodebookLanguage>
</_x0033_0_Codebooks>
<_x0033_0_Codebooks>
<CodebookID>40</CodebookID>
<CodebookName>4.0-item-Frequency-Zulu</CodebookName>
<CodebookExperience>1</CodebookExperience>
<CodebookLanguage>41</CodebookLanguage>
</_x0033_0_Codebooks>
</dataroot>
