<?xml version="1.0" encoding="UTF-8"?>
<dataroot xmlns:od="urn:schemas-microsoft-com:officedata" xmlns:xsi="http://www.w3.org/2001/XMLSchema-instance"  xsi:noNamespaceSchemaLocation="30_Codebooks.xsd" generated="2024-10-08T11:26:16">
<_x0033_0_Codebooks>
<CodebookID>1</CodebookID>
<CodebookName>4.0-item-Freqency-English</CodebookName>
<CodebookExperience>1</CodebookExperience>
<CodebookLanguage>1</CodebookLanguage>
</_x0033_0_Codebooks>
<_x0033_0_Codebooks>
<CodebookID>2</CodebookID>
<CodebookName>4.0-item-Freqency-Arabic</CodebookName>
<CodebookExperience>1</CodebookExperience>
<CodebookLanguage>2</CodebookLanguage>
</_x0033_0_Codebooks>
<_x0033_0_Codebooks>
<CodebookID>3</CodebookID>
<CodebookName>4.0-item-Freqency-Chinese (Simplified)</CodebookName>
<CodebookExperience>1</CodebookExperience>
<CodebookLanguage>3</CodebookLanguage>
</_x0033_0_Codebooks>
<_x0033_0_Codebooks>
<CodebookID>4</CodebookID>
<CodebookName>4.0-item-Freqency-Danish</CodebookName>
<CodebookExperience>1</CodebookExperience>
<CodebookLanguage>4</CodebookLanguage>
</_x0033_0_Codebooks>
<_x0033_0_Codebooks>
<CodebookID>5</CodebookID>
<CodebookName>4.0-item-Freqency-Dutch</CodebookName>
<CodebookExperience>1</CodebookExperience>
<CodebookLanguage>5</CodebookLanguage>
</_x0033_0_Codebooks>
<_x0033_0_Codebooks>
<CodebookID>6</CodebookID>
<CodebookName>4.0-item-Freqency-Estonian</CodebookName>
<CodebookExperience>1</CodebookExperience>
<CodebookLanguage>6</CodebookLanguage>
</_x0033_0_Codebooks>
<_x0033_0_Codebooks>
<CodebookID>7</CodebookID>
<CodebookName>4.0-item-Freqency-Finnish</CodebookName>
<CodebookExperience>1</CodebookExperience>
<CodebookLanguage>7</CodebookLanguage>
</_x0033_0_Codebooks>
<_x0033_0_Codebooks>
<CodebookID>8</CodebookID>
<CodebookName>4.0-item-Freqency-French</CodebookName>
<CodebookExperience>1</CodebookExperience>
<CodebookLanguage>8</CodebookLanguage>
</_x0033_0_Codebooks>
<_x0033_0_Codebooks>
<CodebookID>9</CodebookID>
<CodebookName>4.0-item-Freqency-German</CodebookName>
<CodebookExperience>1</CodebookExperience>
<CodebookLanguage>9</CodebookLanguage>
</_x0033_0_Codebooks>
<_x0033_0_Codebooks>
<CodebookID>10</CodebookID>
<CodebookName>4.0-item-Freqency-Greek</CodebookName>
<CodebookExperience>1</CodebookExperience>
<CodebookLanguage>10</CodebookLanguage>
</_x0033_0_Codebooks>
<_x0033_0_Codebooks>
<CodebookID>11</CodebookID>
<CodebookName>4.0-item-Freqency-Hungarian</CodebookName>
<CodebookExperience>1</CodebookExperience>
<CodebookLanguage>11</CodebookLanguage>
</_x0033_0_Codebooks>
<_x0033_0_Codebooks>
<CodebookID>12</CodebookID>
<CodebookName>4.0-item-Freqency-Icelandic</CodebookName>
<CodebookExperience>1</CodebookExperience>
<CodebookLanguage>12</CodebookLanguage>
</_x0033_0_Codebooks>
<_x0033_0_Codebooks>
<CodebookID>13</CodebookID>
<CodebookName>4.0-item-Freqency-Japanese</CodebookName>
<CodebookExperience>1</CodebookExperience>
<CodebookLanguage>13</CodebookLanguage>
</_x0033_0_Codebooks>
<_x0033_0_Codebooks>
<CodebookID>14</CodebookID>
<CodebookName>4.0-item-Freqency-Korean</CodebookName>
<CodebookExperience>1</CodebookExperience>
<CodebookLanguage>14</CodebookLanguage>
</_x0033_0_Codebooks>
<_x0033_0_Codebooks>
<CodebookID>15</CodebookID>
<CodebookName>4.0-item-Freqency-Lithuanian</CodebookName>
<CodebookExperience>1</CodebookExperience>
<CodebookLanguage>15</CodebookLanguage>
</_x0033_0_Codebooks>
<_x0033_0_Codebooks>
<CodebookID>16</CodebookID>
<CodebookName>4.0-item-Freqency-Norweigan</CodebookName>
<CodebookExperience>1</CodebookExperience>
<CodebookLanguage>16</CodebookLanguage>
</_x0033_0_Codebooks>
<_x0033_0_Codebooks>
<CodebookID>17</CodebookID>
<CodebookName>4.0-item-Freqency-Persian</CodebookName>
<CodebookExperience>1</CodebookExperience>
<CodebookLanguage>17</CodebookLanguage>
</_x0033_0_Codebooks>
<_x0033_0_Codebooks>
<CodebookID>18</CodebookID>
<CodebookName>4.0-item-Freqency-Polish</CodebookName>
<CodebookExperience>1</CodebookExperience>
<CodebookLanguage>18</CodebookLanguage>
</_x0033_0_Codebooks>
<_x0033_0_Codebooks>
<CodebookID>19</CodebookID>
<CodebookName>4.0-item-Freqency-Portuguese</CodebookName>
<CodebookExperience>1</CodebookExperience>
<CodebookLanguage>19</CodebookLanguage>
</_x0033_0_Codebooks>
<_x0033_0_Codebooks>
<CodebookID>20</CodebookID>
<CodebookName>4.0-item-Freqency-Slovene</CodebookName>
<CodebookExperience>1</CodebookExperience>
<CodebookLanguage>20</CodebookLanguage>
</_x0033_0_Codebooks>
<_x0033_0_Codebooks>
<CodebookID>21</CodebookID>
<CodebookName>4.0-item-Freqency-Spanish</CodebookName>
<CodebookExperience>1</CodebookExperience>
<CodebookLanguage>21</CodebookLanguage>
</_x0033_0_Codebooks>
<_x0033_0_Codebooks>
<CodebookID>22</CodebookID>
<CodebookName>4.0-item-Freqency-Swedish</CodebookName>
<CodebookExperience>1</CodebookExperience>
<CodebookLanguage>22</CodebookLanguage>
</_x0033_0_Codebooks>
<_x0033_0_Codebooks>
<CodebookID>23</CodebookID>
<CodebookName>4.0-item-Freqency-Turkish</CodebookName>
<CodebookExperience>1</CodebookExperience>
<CodebookLanguage>23</CodebookLanguage>
</_x0033_0_Codebooks>
<_x0033_0_Codebooks>
<CodebookID>24</CodebookID>
<CodebookName>4.0-item-Freqency-Urdu</CodebookName>
<CodebookExperience>1</CodebookExperience>
<CodebookLanguage>24</CodebookLanguage>
</_x0033_0_Codebooks>
<_x0033_0_Codebooks>
<CodebookID>25</CodebookID>
<CodebookName>4.0-item-Agreement-English</CodebookName>
<CodebookExperience>5</CodebookExperience>
<CodebookLanguage>1</CodebookLanguage>
</_x0033_0_Codebooks>
<_x0033_0_Codebooks>
<CodebookID>26</CodebookID>
<CodebookName>4.0-item-Agreement-Spanish</CodebookName>
<CodebookExperience>5</CodebookExperience>
<CodebookLanguage>21</CodebookLanguage>
</_x0033_0_Codebooks>
<_x0033_0_Codebooks>
<CodebookID>27</CodebookID>
<CodebookName>4.1-item-Frequency-English</CodebookName>
<CodebookExperience>1</CodebookExperience>
<CodebookLanguage>1</CodebookLanguage>
</_x0033_0_Codebooks>
</dataroot>
